{
  "$schema": "./theme.schema.json",
  "spec": "opspot/os1-theme/v1",
  "id": "beauty-wellness",
  "name": "Quiet Botanical",
  "tagline": "Soft neutrals and a calm green for the treatment room.",
  "colors": {
    "light": {
      "surface": "#F7F5F2",
      "brand": "#3B4A3E",
      "brand-strong": "#26312A",
      "on-surface": "#2A2622",
      "on-brand": "rgba(255, 255, 255, 0.96)",
      "success": "#43B36B",
      "warning": "#E8A317",
      "danger": "#E5484D"
    }
  },
  "accessibility": {
    "checked": "2026-07-31",
    "standard": "WCAG 2.1 AA",
    "min_text_ratio": 4.6,
    "notes": "Text and background color choices are provided for review."
  }
}
