{
  "$schema": "./theme.schema.json",
  "spec": "opspot/os1-theme/v1",
  "id": "construction",
  "name": "Blueprint Heavy",
  "tagline": "Slate and machine yellow, readable in full sun.",
  "colors": {
    "light": {
      "surface": "#E8E6E1",
      "brand": "#2C3E50",
      "brand-strong": "#1A252F",
      "on-surface": "#1B1B1B",
      "on-brand": "rgba(255, 255, 255, 0.96)",
      "success": "#2FB562",
      "warning": "#F0A81E",
      "danger": "#E5484D"
    }
  },
  "accessibility": {
    "checked": "2026-07-31",
    "standard": "WCAG 2.1 AA",
    "min_text_ratio": 4.61,
    "notes": "Text and background color choices are provided for review."
  }
}
